{
  "$schema": "../../docs/plugin.schema.json",
  "id": "com.dashfile.avbstudio",
  "name": "AVB 工作台",
  "version": "1.0.0",
  "versionCode": 1000000,
  "author": "EternalDash",
  "description": "AVB 镜像解析、重签、VBMeta 构建、整树重建、A/B 批处理与目录扫描；输出与 avbtool 1.3.0 逐字节一致。",
  "tagline": "解析、重签、重建，一站做完",
  "license": "GPL-3.0-or-later",
  "tags": ["AOSP testkey 内置", "纯 C#"],
  "icon": "🧩",
  "assembly": "AvbStudioPlugin.dll",
  "entryType": "AvbStudioPlugin.AvbPlugin",
  "apiVersion": 1,
  "minHostVersion": "1.0.0"
}
